{
  "key": "cyberpunk/peeling-cabinet-top/mid",
  "path": "sources/peeling-cabinet/top.png",
  "alignment": "exact",
  "aspect": [1, 1],
  "description": "top of the green cabinet, same enamel, no hardware",
  "resolution": [1024, 1024],
  "variantId": "top",
  "physical": { "metallicFactor": 0, "roughnessFactor": 0.65 },
  "finish": { "roughness": [0.52, 0.78], "grain": 0.2, "relief": 1.7 }
}
