{
  "key": "cyberpunk/interior-capsule-floor/mid",
  "path": "sources/interiors/capsule-floor.png",
  "description": "Graphite dark grey industrial anti-slip rubber architectural field, very fine closely spaced rounded grit stipple, worn spacecraft deck finish, subtle rubbed high points, no stripes or plate divisions.",
  "alignment": "tile",
  "tiling": {
    "worldSize": [
      2,
      2
    ]
  },
  "resolution": [
    1024,
    1024
  ],
  "variantId": "field",
  "physical": {
    "metallicFactor": 0,
    "roughnessFactor": 0.77
  },
  "finish": {
    "roughness": [
      0.68,
      0.85
    ],
    "grain": 0.18,
    "relief": 0.5
  }
}
