{
  "key": "cyberpunk/interior-loft-brick/rich",
  "path": "sources/interiors/loft-brick.png",
  "description": "reclaimed terracotta brick for loft accent walls",
  "alignment": "tile",
  "tiling": {
    "worldSize": [
      1,
      1
    ]
  },
  "resolution": [
    1024,
    1024
  ],
  "variantId": "field",
  "physical": {
    "metallicFactor": 0,
    "roughnessFactor": 0.7
  },
  "finish": {
    "roughness": [
      0.61,
      0.82
    ],
    "grain": 0.1,
    "relief": 0.6
  }
}
