{
  "key": "cyberpunk/cracked-concrete/mid",
  "path": "sources/cracked-concrete/field.png",
  "alignment": "tile",
  "tiling": { "worldSize": [2, 2] },
  "description": "weathered grey concrete field with hairline cracks",
  "resolution": [1024, 1024],
  "variantId": "field",
  "physical": { "metallicFactor": 0, "roughnessFactor": 0.72 },
  "finish": { "roughness": [0.62, 0.82], "grain": 0.22, "relief": 1.4 }
}
