{
  "key": "cyberpunk/interior-damaged-floor/poor",
  "path": "sources/interiors/damaged-floor.png",
  "description": "Dark warm grey worn cement architectural field, fine exposed aggregate and diffuse rubbed wear with tiny pits, tired utilitarian indoor concrete, natural restrained tonal variation, no large crack or singular stain.",
  "alignment": "tile",
  "tiling": {
    "worldSize": [
      2,
      2
    ]
  },
  "resolution": [
    1024,
    1024
  ],
  "variantId": "field",
  "physical": {
    "metallicFactor": 0,
    "roughnessFactor": 0.82
  },
  "finish": {
    "roughness": [
      0.72,
      0.92
    ],
    "grain": 0.23,
    "relief": 0.8
  }
}
